<?xml version="1.0" encoding="UTF-8"?>
<Digitalni_sertifikat xmlns="http://www.xml.proj/gradj/digitalni_sertifikat"
    xmlns:xsi="http://www.w3.org/2001/XMLSchema-instance"
    xsi:schemaLocation="http://www.xml.proj/gradj/digitalni_sertifikat ../digitalni_sertifikat.xsd">
    <Osnovni_podaci>
        <Broj_sertifikata>1234</Broj_sertifikata>
        <Datum_i_vreme_izdavanja>2021-11-29T12:00:00</Datum_i_vreme_izdavanja>
    </Osnovni_podaci>
    <Podaci_o_gradjaninu>
        <Ime_i_prezime>Imenko PrezimeniÄ‡</Ime_i_prezime>
        <Pol>Muski</Pol>
        <Datum_rodjenja>1980-01-01</Datum_rodjenja>
        <JMBG>0101980660066</JMBG>
        <Broj_pasosa>0101</Broj_pasosa>
    </Podaci_o_gradjaninu>
    <Vakcinacija>
        <Doza>1/2</Doza>
        <Tip>Pfizer-BioNTech</Tip>
        <Proizvodjac_i_serija>Pfizer,23</Proizvodjac_i_serija>
        <Datum>2021-06-29</Datum>
        <Zdravstvena_ustanova>Dom Zdravlja Novi Sad</Zdravstvena_ustanova>
    </Vakcinacija>
</Digitalni_sertifikat>